{
  "$schema": "http://json-schema.org/draft-07/schema#",
  "$id": "https://hotato.dev/schema/scenario.v1.json",
  "title": "hotato simulation scenario, schema scenario.v1",
  "description": "A deterministic simulation scenario (Phase-2 design 2.1): the ground-truth a scripted caller holds, the caller's scripted turn sequence + behaviour, the environment, and a variation matrix. It is the deterministic INPUT side of a simulation -- there is no live agent and no scoring here. HONESTY INVARIANTS, structural: no `overall_score` (a scenario never scores anything); the caller only ever declares its OWN turns, never the agent's; a scenario is not a verdict. Malformed docs are rejected by hotato.scenario.validate_scenario_doc (ValueError, exit 2) BEFORE any use, mirroring conversation_test.validate_conversation_test_doc.",
  "type": "object",
  "required": ["kind", "version", "id", "goal", "caller"],
  "additionalProperties": true,
  "not": { "required": ["overall_score"] },
  "properties": {
    "kind": { "const": "hotato.scenario" },
    "version": { "const": 1 },
    "overall_score": false,
    "id": { "type": "string", "minLength": 1 },
    "goal": {
      "type": "object",
      "required": ["type", "target"],
      "additionalProperties": true,
      "description": "What the caller is trying to achieve. `type` is the goal kind (e.g. get_refund); `target` names its object (e.g. order A-1001). Descriptive only -- never a success threshold.",
      "properties": {
        "type": { "type": "string", "minLength": 1 },
        "target": { "type": "string", "minLength": 1 }
      }
    },
    "facts": {
      "type": "object",
      "description": "The ground-truth the caller HOLDS (e.g. {order_id: A-1001}). A valid simulation must preserve these -- the caller states its own truth, the simulator never alters it."
    },
    "caller": {
      "type": "object",
      "required": ["script"],
      "additionalProperties": true,
      "description": "The scripted caller: the ordered turns it speaks and how it behaves. The caller declares ONLY its own turns -- a scenario can never put words in the agent's mouth (invariant: the simulator does not solve the task for the agent).",
      "properties": {
        "script": {
          "type": "array",
          "items": { "$ref": "#/definitions/turn" },
          "description": "The ordered caller turns. Each is a `say` (spoken unconditionally), optionally gated by a `when_agent_asks` label (spoken when the agent asks about that label) or sequenced by an `after` label."
        },
        "behavior": { "$ref": "#/definitions/behavior" }
      }
    },
    "environment": {
      "type": "object",
      "additionalProperties": true,
      "description": "The declared rendering environment. All members optional.",
      "properties": {
        "noise": { "type": "string", "description": "A named noise condition (e.g. clean, cafe). The declared perturbation a valid simulation must apply." },
        "codec": { "type": "string" },
        "locale": { "type": "string" }
      }
    },
    "variation_matrix": {
      "type": "object",
      "additionalProperties": true,
      "description": "The cross product `expand()` walks (locale x speaking_rate x noise x behavior x repetitions) into concrete runs, each with a deterministic per-run seed. An absent dimension collapses to the scenario's single declared value.",
      "properties": {
        "locale": { "type": "array", "items": { "type": "string" } },
        "speaking_rate": { "type": "array", "items": { "type": "number", "exclusiveMinimum": 0 } },
        "noise": { "type": "array", "items": { "type": "string" } },
        "behavior": { "type": "array", "items": { "type": "string" } },
        "repetitions": { "type": "integer", "minimum": 1, "default": 1 }
      }
    },
    "seed": {
      "type": "integer",
      "minimum": 0,
      "default": 0,
      "description": "The base seed. A seeded replay is byte-identical; different seeds vary only where the scenario allows (probabilistic backchannels). Never Math.random / time-based."
    },
    "agent_mock": {
      "type": "object",
      "additionalProperties": true,
      "not": { "required": ["overall_score"] },
      "description": "OPTIONAL deterministic MOCK agent (Phase-2 tool mocks + state sandbox; 1.3 item 9). Additive and gated -- a scenario without it renders byte-identically. Lets an OFFLINE simulation exercise the outcome/policy authorities end-to-end: `tools` render as tool_call spans (Authority 1, read by tool_result/tool_error), an optional `handoff`/`termination` render as their own spans, and `state` is a {resource: rows} post-call sandbox (Authority 2) served by a MockStateAdapter to state/state_change. A mock is never a real agent: the produced conversation stays origin=simulated and this evidence is labelled the simulator's, never a live agent's. It declares AGENT-side evidence only -- the caller script stays the only place caller words live.",
      "properties": {
        "tools": {
          "type": "array",
          "items": {
            "type": "object",
            "required": ["name"],
            "additionalProperties": true,
            "properties": {
              "name": { "type": "string", "minLength": 1 },
              "arguments": { "type": "object" },
              "result": { "type": "object" },
              "error": {},
              "latency_ms": { "type": "number", "minimum": 0 }
            }
          }
        },
        "handoff": { "type": "object", "required": ["to"], "additionalProperties": true },
        "termination": { "type": "object", "additionalProperties": true },
        "state": { "type": "object", "description": "A {resource: rows} post-call state sandbox (Authority 2)." }
      }
    }
  },
  "definitions": {
    "turn": {
      "type": "object",
      "required": ["say"],
      "additionalProperties": true,
      "description": "One scripted caller turn. `say` is the spoken text (required). `when_agent_asks` / `after` are optional label triggers; a turn may carry at most one.",
      "properties": {
        "say": { "type": "string", "minLength": 1 },
        "when_agent_asks": { "type": "string" },
        "after": { "type": "string" }
      }
    },
    "behavior": {
      "type": "object",
      "additionalProperties": true,
      "description": "How the caller behaves: its speaking rate, declared barge-in interruptions (fixed offsets), and probabilistic backchannels (the one seed-dependent variation point).",
      "properties": {
        "speaking_rate": { "type": "number", "exclusiveMinimum": 0, "default": 1.0 },
        "interruptions": {
          "type": "array",
          "items": {
            "type": "object",
            "required": ["trigger", "offset_ms"],
            "additionalProperties": true,
            "properties": {
              "trigger": { "type": "string", "minLength": 1 },
              "offset_ms": { "type": "integer", "minimum": 0 }
            }
          },
          "description": "Declared caller barge-ins at fixed offsets -- deterministic (same every seed). A valid simulation must render each declared interruption."
        },
        "backchannels": {
          "type": "object",
          "additionalProperties": true,
          "properties": {
            "probability": { "type": "number", "minimum": 0, "maximum": 1, "default": 0.0 }
          },
          "description": "Probabilistic short acknowledgements. The seeded PRNG decides each candidate -- probability 0 yields none; a fixed seed always fires the same set."
        }
      }
    }
  }
}
