{
  "agent_mock": {
    "state": {
      "accounts": [
        {
          "account_id": "acct_700",
          "reset_pending": true
        }
      ]
    },
    "tools": [
      {
        "arguments": {
          "account_id": "acct_700"
        },
        "latency_ms": 450,
        "name": "verify_identity",
        "result": {
          "verified": true
        }
      },
      {
        "arguments": {
          "account_id": "acct_700"
        },
        "latency_ms": 380,
        "name": "send_reset_link",
        "result": {
          "status": "sent"
        }
      }
    ]
  },
  "caller": {
    "behavior": {
      "backchannels": {
        "probability": 0.0
      }
    },
    "script": [
      {
        "say": "account acct_700, i'm locked out"
      },
      {
        "say": "i need to reset my password"
      }
    ]
  },
  "environment": {
    "locale": "en-US",
    "route": "phone"
  },
  "facts": {
    "account_id": "acct_700"
  },
  "goal": {
    "target": "acct_700",
    "type": "reset_password"
  },
  "id": "password-reset",
  "kind": "hotato.scenario",
  "seed": 0,
  "variation_matrix": {
    "noise": [
      "clean",
      "cafe",
      "street"
    ],
    "repetitions": 1,
    "speaking_rate": [
      0.7,
      0.85,
      1.0,
      1.2,
      1.4
    ]
  },
  "version": 1
}
