{
  "agent_mock": {
    "state": {
      "accounts": [
        {
          "account_id": "acct_320",
          "address": "12 oak street"
        }
      ]
    },
    "tools": [
      {
        "arguments": {
          "account_id": "acct_320"
        },
        "latency_ms": 400,
        "name": "verify_identity",
        "result": {
          "verified": true
        }
      },
      {
        "arguments": {
          "account_id": "acct_320",
          "address": "12 oak street"
        },
        "latency_ms": 520,
        "name": "update_address",
        "result": {
          "status": "updated"
        }
      }
    ]
  },
  "caller": {
    "behavior": {
      "backchannels": {
        "probability": 0.8
      }
    },
    "script": [
      {
        "say": "hi, account acct_320"
      },
      {
        "say": "i want to update my address to 12 oak street"
      }
    ]
  },
  "environment": {
    "locale": "en-US",
    "route": "phone"
  },
  "facts": {
    "account_id": "acct_320"
  },
  "goal": {
    "target": "acct_320",
    "type": "update_address"
  },
  "id": "backchannel-heavy-address-change",
  "kind": "hotato.scenario",
  "seed": 0,
  "variation_matrix": {
    "noise": [
      "clean",
      "cafe",
      "street"
    ],
    "repetitions": 1,
    "speaking_rate": [
      0.7,
      0.85,
      1.0,
      1.2,
      1.4
    ]
  },
  "version": 1
}
