{
  "kind": "hotato.scenario",
  "version": 1,
  "id": "over-eager-early-response",
  "goal": { "type": "complete_multi_part_request", "target": "food order" },
  "facts": {},
  "caller": {
    "script": [
      { "say": "I'd like to order a large..." },
      { "say": "...pepperoni pizza and a side of garlic bread." }
    ],
    "behavior": {
      "speaking_rate": 1.0,
      "backchannels": { "probability": 0.0 }
    }
  },
  "environment": { "locale": "en-US", "noise": "clean", "route": "phone" },
  "seed": 404
}
